Link,Title
https://finance.yahoo.com/news/cloudera-inc-cldr-stock-sinks-215009583.html,Cloudera  Inc. (CLDR) Stock Sinks As Market Gains: What You Should Know
https://finance.yahoo.com/news/understanding-clouderas-unusual-options-activity-181132108.html,Understanding Cloudera's Unusual Options Activity
https://finance.yahoo.com/news/did-hedge-funds-call-cloudera-140726158.html,Did Hedge Funds Make The Right Call On Cloudera  Inc. (CLDR) ?
https://finance.yahoo.com/news/institutions-heavily-invested-cloudera-inc-151601424.html,Are Institutions Heavily Invested In Cloudera  Inc.'s (NYSE:CLDR) Shares?
https://finance.yahoo.com/news/cloudera-cldr-stock-solid-choice-123212577.html,Is Cloudera (CLDR) Stock a Solid Choice Right Now?
https://finance.yahoo.com/m/c2e3eef2-db70-34dc-8047-0dc2bb2ca6eb/why-cloudera-stock-is-cheaper.html,Why Cloudera Stock Is Cheaper Than It Looks
https://finance.yahoo.com/news/buy-cloudera-inc-cldr-215637329.html,Should You Buy Cloudera  Inc. (CLDR)?
https://finance.yahoo.com/news/cloudera-analysts-examine-potential-suitors-174636742.html,Cloudera Analysts Examine Potential Suitors  Takeout Price Amid Sale Rumor
https://finance.yahoo.com/m/4310da58-91fa-39b6-a048-f8884926d715/federal-reserve-cloudera-.html,Federal Reserve  Cloudera  Snowflake  CrossFit: 5 Things You Must Know Wednesday
https://finance.yahoo.com/m/bd7b1720-8424-3df5-90ee-59b5f3e90558/ibm-is-the-most-likely.html,IBM Is the Most Likely Strategic Buyer of Cloudera: Analyst
